{
  "version": 1,
  "nombre": "Mina académica de Nivel 1",
  "nodos": [
    {
      "id": "n1",
      "x": 0,
      "y": 0,
      "nivel": 0,
      "tipo": "salida"
    },
    {
      "id": "n2",
      "x": 100,
      "y": 0,
      "nivel": -50,
      "tipo": "interseccion"
    },
    {
      "id": "n3",
      "x": 200,
      "y": 0,
      "nivel": -50,
      "tipo": "interseccion"
    },
    {
      "id": "n4",
      "x": 300,
      "y": 0,
      "nivel": -50,
      "tipo": "refugio"
    },
    {
      "id": "n5",
      "x": 450,
      "y": 0,
      "nivel": -50,
      "tipo": "frente"
    },
    {
      "id": "n6",
      "x": 200,
      "y": 100,
      "nivel": -100,
      "tipo": "interseccion"
    },
    {
      "id": "n7",
      "x": 400,
      "y": 100,
      "nivel": -100,
      "tipo": "frente"
    },
    {
      "id": "n8",
      "x": 300,
      "y": 100,
      "nivel": -100,
      "tipo": "interseccion"
    },
    {
      "id": "n9",
      "x": 0,
      "y": 100,
      "nivel": -50,
      "tipo": "interseccion"
    },
    {
      "id": "n10",
      "x": 100,
      "y": 100,
      "nivel": -50,
      "tipo": "interseccion"
    },
    {
      "id": "n11",
      "x": 0,
      "y": 200,
      "nivel": 0,
      "tipo": "salida"
    },
    {
      "id": "n12",
      "x": 100,
      "y": 200,
      "nivel": -50,
      "tipo": "refugio"
    },
    {
      "id": "n13",
      "x": 200,
      "y": 200,
      "nivel": -50,
      "tipo": "frente"
    },
    {
      "id": "n14",
      "x": 100,
      "y": 200,
      "nivel": -100,
      "tipo": "interseccion"
    },
    {
      "id": "n15",
      "x": 200,
      "y": 200,
      "nivel": -100,
      "tipo": "refugio"
    },
    {
      "id": "n16",
      "x": 300,
      "y": 200,
      "nivel": -100,
      "tipo": "frente"
    }
  ],
  "aristas": [
    {
      "id": "tunel_1_2",
      "origen": "n1",
      "destino": "n2",
      "longitud_m": 120
    },
    {
      "id": "tunel_2_3",
      "origen": "n2",
      "destino": "n3",
      "longitud_m": 100
    },
    {
      "id": "tunel_3_4",
      "origen": "n3",
      "destino": "n4",
      "longitud_m": 100
    },
    {
      "id": "tunel_4_5",
      "origen": "n4",
      "destino": "n5",
      "longitud_m": 150
    },
    {
      "id": "tunel_3_6",
      "origen": "n3",
      "destino": "n6",
      "longitud_m": 120
    },
    {
      "id": "tunel_6_8",
      "origen": "n6",
      "destino": "n8",
      "longitud_m": 100
    },
    {
      "id": "tunel_8_7",
      "origen": "n8",
      "destino": "n7",
      "longitud_m": 100
    },
    {
      "id": "tunel_8_4",
      "origen": "n8",
      "destino": "n4",
      "longitud_m": 120
    },
    {
      "id": "tunel_2_10",
      "origen": "n2",
      "destino": "n10",
      "longitud_m": 100
    },
    {
      "id": "tunel_9_10",
      "origen": "n9",
      "destino": "n10",
      "longitud_m": 100
    },
    {
      "id": "tunel_9_11",
      "origen": "n9",
      "destino": "n11",
      "longitud_m": 120
    },
    {
      "id": "tunel_10_12",
      "origen": "n10",
      "destino": "n12",
      "longitud_m": 100
    },
    {
      "id": "tunel_12_13",
      "origen": "n12",
      "destino": "n13",
      "longitud_m": 100
    },
    {
      "id": "tunel_12_14",
      "origen": "n12",
      "destino": "n14",
      "longitud_m": 60
    },
    {
      "id": "tunel_14_15",
      "origen": "n14",
      "destino": "n15",
      "longitud_m": 100
    },
    {
      "id": "tunel_15_16",
      "origen": "n15",
      "destino": "n16",
      "longitud_m": 100
    },
    {
      "id": "tunel_6_15",
      "origen": "n6",
      "destino": "n15",
      "longitud_m": 100
    },
    {
      "id": "tunel_8_16",
      "origen": "n8",
      "destino": "n16",
      "longitud_m": 100
    },
    {
      "id": "tunel_10_6",
      "origen": "n10",
      "destino": "n6",
      "longitud_m": 120
    },
    {
      "id": "tunel_13_15",
      "origen": "n13",
      "destino": "n15",
      "longitud_m": 60
    }
  ]
}
